{
  "schema_version": "simulation-plan.v1",
  "request_id": "h618-agentboard-v1-initial",
  "project_id": "h618-agentboard-v1",
  "project_name": "h618_agentboard_v1_initial",
  "topology": "h618_agentboard_v1_initial",
  "source_profile": {
    "schema_version": "simulation-profile.v1",
    "profile_id": "h618_agentboard_v1_initial-profile"
  },
  "scenarios": [
    {
      "scenario_id": "power-startup",
      "title": "Power startup check",
      "backend": "ngspice",
      "analysis_kind": "tran",
      "focus": "Validate power rail startup and regulation.",
      "focus_components": [],
      "focus_nets": [
        "+5V_IN",
        "+3V3",
        "+5V_SYS",
        "+1V8",
        "+1V1_CORE",
        "+1V2_DDR"
      ],
      "stimuli": [
        "Input supply sweep",
        "Load step"
      ],
      "success_criteria": [
        "Primary rail reaches nominal voltage.",
        "Startup does not overshoot excessively.",
        "Output remains stable under a modest load step."
      ],
      "notes": [
        "Prefer a vendor model when the regulator is a switching IC."
      ]
    },
    {
      "scenario_id": "usb-input-protection",
      "title": "USB input protection check",
      "backend": "ngspice",
      "analysis_kind": "op",
      "focus": "Confirm VBUS protection and idle biasing.",
      "focus_components": [],
      "focus_nets": [],
      "stimuli": [
        "Apply nominal VBUS",
        "Observe clamp and fuse behavior"
      ],
      "success_criteria": [
        "Normal VBUS is not clamped under nominal conditions.",
        "Protection parts do not distort the rail during idle bias."
      ],
      "notes": [
        "Use DC operating point first; transient only if the model supports it."
      ]
    },
    {
      "scenario_id": "esp32-startup-and-strap",
      "title": "ESP32 startup and strap check",
      "backend": "ngspice",
      "analysis_kind": "op",
      "focus": "Check ESP32 reset, boot, strap, clock, and supply bias states at power-up.",
      "focus_components": [],
      "focus_nets": [],
      "stimuli": [
        "Power applied at nominal input",
        "Observe strap sampling window",
        "Check crystal bias and decoupling"
      ],
      "success_criteria": [
        "Reset remains asserted long enough during startup.",
        "Boot strap pins settle to the intended logic state.",
        "Crystal and decoupling nets bias correctly at startup."
      ],
      "notes": [
        "This is a functional check, not a full timing-accuracy proof."
      ]
    },
    {
      "scenario_id": "rp2040-debug-and-bootsel",
      "title": "RP2040 debug and BOOTSEL check",
      "backend": "ngspice",
      "analysis_kind": "op",
      "focus": "Check RP2040 boot selection, SWD access, and low-speed bias paths.",
      "focus_components": [],
      "focus_nets": [
        "H618_UART0_TX",
        "H618_UART0_RX",
        "H618_26PIN_UART5_TX_PH2",
        "H618_26PIN_UART5_RX_PH3",
        "H618_26PIN_UART2_RTS_TWI4_SDA_PH7",
        "H618_26PIN_UART2_CTS_PH8",
        "H618_26PIN_UART2_RX_TWI4_SCK_PH6",
        "H618_COPRO_UART"
      ],
      "stimuli": [
        "Power applied at nominal input",
        "Observe boot selection and SWD bias",
        "Measure VTREF divider behavior"
      ],
      "success_criteria": [
        "BOOTSEL control remains in the intended default state.",
        "SWD and reset bias networks settle cleanly.",
        "VTREF sensing path produces a stable reference voltage."
      ],
      "notes": [
        "This check is aimed at low-speed control and debug paths, not firmware execution."
      ]
    },
    {
      "scenario_id": "indicator-current",
      "title": "Indicator current check",
      "backend": "ngspice",
      "analysis_kind": "op",
      "focus": "Verify LED bias current and resistor sizing.",
      "focus_components": [],
      "focus_nets": [],
      "stimuli": [
        "DC operating point"
      ],
      "success_criteria": [
        "LED current stays within the target range.",
        "Series resistor dissipation is safe."
      ],
      "notes": [
        "Useful as a quick sanity check for visible indicators."
      ]
    },
    {
      "scenario_id": "interface-bias",
      "title": "Interface bias and coupling check",
      "backend": "ngspice",
      "analysis_kind": "op",
      "focus": "Validate interface biasing, VTREF sensing, and basic connectivity.",
      "focus_components": [],
      "focus_nets": [
        "H618_UART0_TX",
        "H618_UART0_RX",
        "H618_SPI_NOR",
        "H618_26PIN_PH5_TWI3_SDA_SPI1_CS0",
        "H618_26PIN_UART5_TX_PH2",
        "H618_26PIN_UART5_RX_PH3",
        "H618_26PIN_UART2_RTS_TWI4_SDA_PH7",
        "H618_26PIN_UART2_CTS_PH8",
        "H618_26PIN_UART2_RX_TWI4_SCK_PH6",
        "H618_26PIN_SPI1_CS0_PH9",
        "H618_COPRO_UART"
      ],
      "stimuli": [
        "DC operating point"
      ],
      "success_criteria": [
        "Interface bias nets sit at intended levels.",
        "No obvious floating interface supply is detected.",
        "VTREF sensing remains stable across the interface network."
      ],
      "notes": [
        "This is a lightweight pre-check, not a high-frequency RF simulation."
      ]
    }
  ],
  "summary": {
    "scenario_count": 6,
    "analysis_kinds": [
      "op",
      "tran"
    ],
    "backend": "ngspice"
  },
  "recommendations": [
    "Start with the baseline operating-point check.",
    "Prefer transient analysis for startup behavior and DC operating point for bias checks."
  ]
}
